{
  "schemaVersion": 1,
  "contractId": "epic-k-shopify-source-mapping",
  "version": "1.1.0",
  "projectApiVersion": "2026-07",
  "auditApiVersion": "2026-10",
  "verifiedAt": "2026-10-24T14:25:37.885Z",
  "storeRef": "RHINO_LAPIDARY",
  "sourceVerificationStatus": "verified",
  "productOwnerMappingAcceptanceStatus": "pending",
  "mappings": [
    {
      "normalizedPath": "source.apiVersion",
      "dataset": "provenance",
      "shopifySource": "Versioned Admin GraphQL endpoint; the authorized connector reported Admin API 2026-10 during validation",
      "requiredReadPermission": "authenticated Admin API query access",
      "transformation": "Record the exact endpoint or connector-reported API version without substitution",
      "pagination": "not applicable",
      "shopifyEstablishesFact": true,
      "operationalApprovalRequired": false,
      "unavailableBehavior": "Block collection provenance rather than infer a version",
      "status": "verified"
    },
    {
      "normalizedPath": "source.sourceVerificationStatus",
      "dataset": "provenance",
      "shopifySource": "Admin GraphQL shop.myshopifyDomain identity query and authorized endpoint",
      "requiredReadPermission": "authenticated Admin API query access",
      "transformation": "Set verified only after the returned myshopifyDomain exactly matches the authorized Rhino store",
      "pagination": "not applicable",
      "shopifyEstablishesFact": true,
      "operationalApprovalRequired": false,
      "unavailableBehavior": "Abort collection and do not normalize the response as Rhino evidence",
      "status": "verified"
    },
    {
      "normalizedPath": "source.mappingAcceptanceStatus",
      "dataset": "provenance",
      "shopifySource": "Product Owner mapping acceptance record; not supplied by Shopify",
      "requiredReadPermission": "not applicable",
      "transformation": "Keep pending until the Product Owner explicitly accepts the verified normalization mapping",
      "pagination": "not applicable",
      "shopifyEstablishesFact": false,
      "operationalApprovalRequired": false,
      "unavailableBehavior": "Keep mapping acceptance pending and block an accepted mapping claim",
      "status": "partial"
    },
    {
      "normalizedPath": "source.collectionAuthorizationStatus",
      "dataset": "provenance",
      "shopifySource": "Product Owner authorization for the bounded read-only K1B-02 audit",
      "requiredReadPermission": "not applicable",
      "transformation": "Record read-only collection authorization without promoting operational readiness",
      "pagination": "not applicable",
      "shopifyEstablishesFact": false,
      "operationalApprovalRequired": false,
      "unavailableBehavior": "Block collection provenance",
      "status": "verified"
    },
    {
      "normalizedPath": "source.operationalAuthorityStatus",
      "dataset": "provenance",
      "shopifySource": "Epic E/F owners, warehouse, shipping operations, finance, and other evidence owners; not supplied by Shopify",
      "requiredReadPermission": "not applicable",
      "transformation": "Remain blocked until the applicable authoritative evidence receipts are accepted",
      "pagination": "not applicable",
      "shopifyEstablishesFact": false,
      "operationalApprovalRequired": true,
      "unavailableBehavior": "Keep operational authority blocked",
      "status": "requires_operational_evidence"
    },
    {
      "normalizedPath": "profiles[]",
      "dataset": "profiles",
      "shopifySource": "QueryRoot.deliveryProfiles -> DeliveryProfile id, name, default, coversAllItems",
      "requiredReadPermission": "read_shipping",
      "transformation": "Replace GIDs with deterministic references; retain configuration flags",
      "pagination": "Exhaust deliveryProfiles.pageInfo",
      "shopifyEstablishesFact": true,
      "operationalApprovalRequired": false,
      "unavailableBehavior": "Set profiles completeness to inaccessible or partial",
      "status": "verified"
    },
    {
      "normalizedPath": "profiles[].assignedProductRefs",
      "dataset": "profiles",
      "shopifySource": "DeliveryProfile.profileItems -> DeliveryProfileItem.product and variants",
      "requiredReadPermission": "read_shipping and read_products",
      "transformation": "Map every assigned Variant to its sanitized Variant reference",
      "pagination": "Exhaust profileItems and nested variants; any nested next page makes the dataset partial",
      "shopifyEstablishesFact": true,
      "operationalApprovalRequired": false,
      "unavailableBehavior": "Do not infer an assignment; mark profiles partial",
      "status": "verified"
    },
    {
      "normalizedPath": "profiles[].machineShipmentMode",
      "dataset": "profiles",
      "shopifySource": "No single DeliveryProfile field proves quotation-only checkout enforcement",
      "requiredReadPermission": "read_shipping",
      "transformation": "Set unverified unless separately supported enforcement evidence exists",
      "pagination": "not applicable",
      "shopifyEstablishesFact": false,
      "operationalApprovalRequired": true,
      "unavailableBehavior": "Use unverified; never infer quotation enforcement",
      "status": "requires_operational_evidence"
    },
    {
      "normalizedPath": "zones[]",
      "dataset": "zones",
      "shopifySource": "DeliveryProfileLocationGroup.locationGroupZones -> DeliveryZone.countries and provinces",
      "requiredReadPermission": "read_shipping",
      "transformation": "Normalize countryCode and province code; preserve rest-of-world as unresolved rather than a country",
      "pagination": "Exhaust every locationGroupZones connection",
      "shopifyEstablishesFact": true,
      "operationalApprovalRequired": false,
      "unavailableBehavior": "Set zones completeness to partial or inaccessible",
      "status": "verified"
    },
    {
      "normalizedPath": "rates[]",
      "dataset": "rates",
      "shopifySource": "DeliveryLocationGroupZone.methodDefinitions -> active, methodConditions, rateProvider",
      "requiredReadPermission": "read_shipping",
      "transformation": "Fixed prices become cents; a zero fixed price is verified zero; carrier participants remain unverified because the final checkout price is dynamic",
      "pagination": "Exhaust every methodDefinitions connection",
      "shopifyEstablishesFact": true,
      "operationalApprovalRequired": true,
      "unavailableBehavior": "Keep amount null and effectivePriceStatus unverified",
      "status": "verified"
    },
    {
      "normalizedPath": "rates[].operationalApproval",
      "dataset": "rates",
      "shopifySource": "No Shopify shipping-rate field represents Rhino operations approval",
      "requiredReadPermission": "not available from Shopify",
      "transformation": "Set missing until an accepted K-EVID receipt is attached",
      "pagination": "not applicable",
      "shopifyEstablishesFact": false,
      "operationalApprovalRequired": true,
      "unavailableBehavior": "Use missing",
      "status": "requires_operational_evidence"
    },
    {
      "normalizedPath": "discounts[]",
      "dataset": "discounts",
      "shopifySource": "QueryRoot.discountNodes -> Discount union type, status, classes, appDiscountType",
      "requiredReadPermission": "read_discounts",
      "transformation": "Free-shipping union types map to zero_shipping; active shipping-class app discounts map to unverified unless their complete price effect is proven",
      "pagination": "Exhaust discountNodes.pageInfo",
      "shopifyEstablishesFact": true,
      "operationalApprovalRequired": false,
      "unavailableBehavior": "Set discounts completeness to inaccessible; never treat missing data as no discounts",
      "status": "verified"
    },
    {
      "normalizedPath": "discounts[].shippingEffect",
      "dataset": "discounts",
      "shopifySource": "Discount union typename, Discount.discountClasses, and AppDiscountType.discountClasses",
      "requiredReadPermission": "read_discounts",
      "transformation": "Explicit free shipping is zero_shipping; shipping Functions and reduced-shipping effects remain unverified without effective-price proof",
      "pagination": "covered by discountNodes pagination",
      "shopifyEstablishesFact": false,
      "operationalApprovalRequired": false,
      "unavailableBehavior": "Use unverified for any active unknown shipping effect",
      "status": "partial"
    },
    {
      "normalizedPath": "markets[]",
      "dataset": "markets",
      "shopifySource": "QueryRoot.markets -> Market.status, Market.conditions.regionsCondition, Market.delivery.shipping",
      "requiredReadPermission": "read_markets",
      "transformation": "Normalize country and subdivision regions and active state",
      "pagination": "Exhaust markets and nested regions connections",
      "shopifyEstablishesFact": true,
      "operationalApprovalRequired": false,
      "unavailableBehavior": "Set markets completeness to partial or inaccessible",
      "status": "verified"
    },
    {
      "normalizedPath": "markets[].checkoutAvailabilityEvidence",
      "dataset": "markets",
      "shopifySource": "Market ACTIVE status and regions do not independently prove a successful checkout path",
      "requiredReadPermission": "read_markets",
      "transformation": "Use unverified unless a separately authorized checkout assessment confirms or disproves availability",
      "pagination": "covered by market pagination",
      "shopifyEstablishesFact": false,
      "operationalApprovalRequired": false,
      "unavailableBehavior": "Use unverified",
      "status": "partial"
    },
    {
      "normalizedPath": "pickup[]",
      "dataset": "pickup",
      "shopifySource": "QueryRoot.locations -> Location.isActive and Location.localPickupSettingsV2",
      "requiredReadPermission": "read_locations",